{
  "executionStepId": "exec-runtime-github-construction-website-repo-20260703-run-validation",
  "planId": "plan-runtime-github-construction-website-repo-20260703",
  "jobId": "job-runtime-github-construction-website-repo-20260703",
  "projectId": "project-unregistered-construction-website",
  "stepType": "run_validation",
  "status": "done",
  "riskLevel": "R1",
  "command": "npm.cmd run validate",
  "expectedResult": "Local AG OS validation completes without live service calls, deployments, credentials, paid usage, or production data.",
  "evidenceRequired": [
    "local validation command output",
    "no live service calls",
    "no credentials used"
  ],
  "rollbackRequired": false,
  "rollbackPlan": "Remove the generated dry-run record chain if validation fails before merge.",
  "safety": {
    "credentialsAllowed": false,
    "liveServiceUseAllowed": false,
    "deploymentAllowed": false,
    "domainChangeAllowed": false,
    "productionDataAllowed": false,
    "paidActionAllowed": false
  },
  "createdAt": "2026-07-03T20:45:00.000Z",
  "updatedAt": "2026-07-03T20:45:00.000Z"
}
