{
  "executionStepId": "exec-runtime-ag-os-accepted-lesson-reuse-proof-20260713-run-validation",
  "planId": "plan-runtime-ag-os-accepted-lesson-reuse-proof-20260713",
  "jobId": "job-runtime-ag-os-accepted-lesson-reuse-proof-20260713",
  "projectId": "project-ag-os-coordinator-runtime",
  "stepType": "run_validation",
  "status": "done",
  "riskLevel": "R1",
  "command": "npm.cmd run validate",
  "expectedResult": "Local AG OS validation completes without live service calls, deployments, credentials, paid usage, or production data.",
  "evidenceRequired": [
    "local validation command output",
    "no live service calls",
    "no credentials used"
  ],
  "rollbackRequired": false,
  "rollbackPlan": "Remove the generated dry-run record chain if validation fails before merge.",
  "safety": {
    "credentialsAllowed": false,
    "liveServiceUseAllowed": false,
    "deploymentAllowed": false,
    "domainChangeAllowed": false,
    "productionDataAllowed": false,
    "paidActionAllowed": false
  },
  "createdAt": "2026-07-13T09:35:12.628Z",
  "updatedAt": "2026-07-13T09:35:12.628Z"
}
